{
  "schema_version": 1,
  "id": "gguf-q4-k-m",
  "model_id": "google/gemma-4-E2B-it",
  "format": "gguf",
  "bits": 4.5,
  "hf_id": "lmstudio-community/gemma-4-E2B-it-GGUF",
  "files": [
    "gemma-4-E2B-it-Q4_K_M.gguf",
    "mmproj-gemma-4-E2B-it-BF16.gguf"
  ],
  "size_gb": 3.43,
  "engines": [
    "llamacpp",
    "ollama",
    "lmstudio"
  ],
  "source": "community",
  "notes": "3.43 GB text GGUF. BF16 mmproj (+0.99 GB) for image/audio input."
}