{
  "schema_version": 1,
  "id": "bf16",
  "model_id": "Qwen/Qwen-Image-2.1",
  "format": "bf16",
  "bits": 16,
  "hf_id": "Qwen/Qwen-Image-2.1",
  "revision": null,
  "files": [],
  "size_gb": 33.11,
  "engines": [
    "qwen-image-spark",
    "vllm-omni",
    "sglang-diffusion",
    "comfyui"
  ],
  "source": "official",
  "notes": "The published weights. size_gb is the sum of the three components' safetensors bytes (transformer 14.23 + text encoder 17.53 + VAE 1.35), which is what is resident with no offload. This is the reference every other quantization of this model is measured against, and the only one with no accuracy question attached."
}
