{
  "schema_version": 1,
  "id": "int4",
  "model_id": "ling-3.0-flash",
  "format": "int4",
  "bits": 4,
  "hf_id": "inclusionAI/Ling-3.0-flash-int4",
  "revision": null,
  "size_gb": 64.0,
  "engines": [
    "vllm",
    "sglang"
  ],
  "source": "official",
  "notes": "Verify the repository id: the int4 release may live under a different name."
}
