{
  "schema_version": 1,
  "id": "mlx-6bit",
  "model_id": "google/gemma-4-E2B-it",
  "format": "mlx",
  "bits": 6.5,
  "hf_id": "lmstudio-community/gemma-4-E2B-it-MLX-6bit",
  "revision": null,
  "size_gb": 5.11,
  "engines": [
    "lmstudio",
    "mlx-lm"
  ],
  "source": "community",
  "notes": "size_gb is the safetensors payload of the repository (6-bit weights with the embeddings and the towers left wider, which is why the ladder from 4 to 8 bit is far flatter than the bit count suggests). LM Studio shows a slightly larger figure because it counts the tokenizer as well."
}
