{
  "schema_version": 1,
  "id": "bf16",
  "model_id": "nemotron-3.5-lightning-30b-a3b",
  "format": "bf16",
  "bits": 16,
  "hf_id": "nvidia/Nemotron-3.5-Lightning-30B-A3B",
  "revision": null,
  "size_gb": 60.0,
  "engines": [
    "vllm",
    "sglang",
    "tensorrt-llm",
    "tgi"
  ],
  "source": "official",
  "notes": "Mamba/SSM state cache is fp32 by default, which is a real memory cost on long contexts."
}
