{
  "schema_version": 1,
  "id": "fp8",
  "model_id": "meta-llama/Llama-3.1-8B-Instruct",
  "format": "fp8",
  "bits": 8,
  "hf_id": "RedHatAI/Meta-Llama-3.1-8B-Instruct-FP8",
  "revision": null,
  "size_gb": 8.5,
  "engines": [
    "vllm",
    "sglang",
    "tensorrt-llm",
    "tgi"
  ],
  "source": "community",
  "notes": null
}
