{
  "schema_version": 1,
  "id": "awq-int4",
  "model_id": "llama-3.1-8b",
  "format": "awq-int4",
  "bits": 4,
  "hf_id": "hugging-quants/Meta-Llama-3.1-8B-Instruct-AWQ-INT4",
  "revision": null,
  "size_gb": 5.7,
  "engines": [
    "vllm",
    "sglang",
    "tgi"
  ],
  "source": "community",
  "notes": null
}
