{
  "schema_version": 1,
  "id": "gguf-q4-k-m",
  "model_id": "orcarouter/Qwen3.8-27B-Uncensored",
  "format": "gguf",
  "bits": 4.8,
  "hf_id": "orcarouter/Qwen3.8-27B-Uncensored-GGUF",
  "revision": null,
  "files": [
    "Qwen3.8-27B-Uncensored-Q4_K_M.gguf"
  ],
  "size_gb": 16.0,
  "engines": [
    "llamacpp",
    "ollama",
    "lmstudio"
  ],
  "source": "community",
  "notes": "Includes mmproj for vision support (885 MB additional)."
}