{
  "schema_version": 1,
  "id": "bf16",
  "model_id": "meta-llama/Llama-3.3-70B-Instruct",
  "format": "bf16",
  "bits": 16,
  "hf_id": "meta-llama/Llama-3.3-70B-Instruct",
  "revision": null,
  "size_gb": 141.0,
  "engines": [
    "vllm",
    "sglang",
    "tensorrt-llm",
    "tgi"
  ],
  "source": "official",
  "notes": null
}
