{
  "schema_version": 1,
  "id": "fp8",
  "model_id": "nemotron-3.5-lightning-30b-a3b",
  "format": "fp8",
  "bits": 8,
  "hf_id": "nvidia/Nemotron-3.5-Lightning-30B-A3B-FP8",
  "revision": null,
  "size_gb": 31.0,
  "engines": [
    "vllm",
    "sglang",
    "tensorrt-llm",
    "tgi"
  ],
  "source": "official",
  "notes": null
}
