{
  "schema_version": 1,
  "id": "mxfp4",
  "model_id": "openai/gpt-oss-120b",
  "format": "mxfp4",
  "bits": 4.25,
  "hf_id": "openai/gpt-oss-120b",
  "revision": null,
  "size_gb": 63.4,
  "engines": [
    "vllm",
    "sglang",
    "tensorrt-llm",
    "tgi"
  ],
  "source": "official",
  "notes": "Ships natively in MXFP4; there is no BF16 release. Fits an 80 GB card, which is the whole design point."
}
