{
  "schema_version": 1,
  "id": "gguf-mxfp4",
  "model_id": "openai/gpt-oss-120b",
  "format": "gguf",
  "bits": 4.25,
  "hf_id": "unsloth/gpt-oss-120b-GGUF",
  "revision": null,
  "files": [
    "gpt-oss-120b-MXFP4.gguf"
  ],
  "ollama_tag": "gpt-oss:120b",
  "size_gb": 63.4,
  "engines": [
    "llamacpp",
    "ollama",
    "lmstudio"
  ],
  "source": "community",
  "notes": "Community quantization: the repository is the most likely one but has not been verified. Confirm the repo and the file name before running, and correct this record in the same PR if it is wrong."
}
