{
  "schema_version": 1,
  "id": "bf16",
  "model_id": "ling-3.0-flash",
  "format": "bf16",
  "bits": 16,
  "hf_id": "inclusionAI/Ling-3.0-flash",
  "revision": null,
  "size_gb": 256.0,
  "engines": [
    "vllm",
    "sglang",
    "tensorrt-llm",
    "tgi"
  ],
  "source": "official",
  "notes": "Does not fit any single device in this registry; listed for completeness and for multi-GPU runs."
}
