{
  "schema_version": 1,
  "id": "bf16",
  "model_id": "google/gemma-3-27b-it",
  "format": "bf16",
  "bits": 16,
  "hf_id": "google/gemma-3-27b-it",
  "revision": null,
  "size_gb": 54.8,
  "engines": [
    "vllm",
    "sglang",
    "tensorrt-llm",
    "tgi"
  ],
  "source": "official",
  "notes": null
}
