{
  "schema_version": 1,
  "id": "gguf-ud-q4-k-xl",
  "model_id": "Qwen/Qwen3.8-Flash-Next",
  "format": "gguf",
  "bits": 5.03,
  "hf_id": "unsloth/Qwen3.8-Flash-Next-GGUF",
  "revision": null,
  "files": [
    "Qwen3.8-Flash-Next-UD-Q4_K_XL-00001-of-00004.gguf",
    "Qwen3.8-Flash-Next-UD-Q4_K_XL-00002-of-00004.gguf",
    "Qwen3.8-Flash-Next-UD-Q4_K_XL-00003-of-00004.gguf",
    "Qwen3.8-Flash-Next-UD-Q4_K_XL-00004-of-00004.gguf"
  ],
  "ollama_tag": null,
  "size_gb": 111.3,
  "engines": [
    "llamacpp"
  ],
  "source": "community",
  "calibration": "imatrix",
  "links": {
    "hf": "https://huggingface.co/unsloth/Qwen3.8-Flash-Next-GGUF"
  },
  "notes": "Unsloth dynamic quant (general.quantized_by=Unsloth, quantization_version 2, file_type 15). imatrix calibrated: quantize.imatrix.file=Qwen3.8-Flash-Next-GGUF/imatrix_unsloth.gguf, dataset unsloth_calibration_Qwen3.8-Flash-Next.txt, 926 entries over 45 chunks - all read from the GGUF KV metadata of the actual files used. bits 5.03 is computed from the real on-disk size (111,323,630,080 bytes over 176,943,899,520 parameters), not the nominal Q4 label; the UD scheme keeps some tensors at higher precision, and the 51.2B n-gram table dominates the file. size_gb is the sum of the four shards in decimal GB (103.7 GiB). Only llamacpp is listed because loading this architecture needs the unmerged qwen4exp support from llama.cpp PR #27742; no released engine can read these files yet."
}
